{
  "schema": "knowledge-hub.paper.paper-retrieval-lane-split-parsed-artifact-evidence-chunk-dry-run.v1",
  "status": "ready",
  "generatedAt": "2026-05-28T07:59:54Z",
  "decision": "paper_retrieval_lane_split_parsed_artifact_evidence_chunk_dry_run_ready",
  "nextRecommendedTranche": "paper_retrieval_lane_split_parsed_artifact_evidence_chunk_contract_review",
  "input": {
    "sourceVisualRetrievalHintFinalMergeReviewRef": "eval/knowledgeos/reports/limited_visual_retrieval_hint_final_merge_review_005.v1.json",
    "expectedVisualHintRows": 125,
    "targetRuntimeBoundary": "knowledge_hub.ai.rag_search_runtime.RAGSearchRuntime.search_with_diagnostics",
    "targetPipelineBoundary": "knowledge_hub.ai.retrieval_pipeline.RetrievalPipelineService.execute",
    "targetEvidenceBoundary": "knowledge_hub.ai.evidence_assembly.EvidenceAssemblyService.assemble"
  },
  "policy": {
    "dryRunOnly": true,
    "laneSplitDesignOnly": true,
    "candidateDiscoveryOnlyForVisualHints": true,
    "parsedArtifactEvidenceRequiredForAnswerability": true,
    "runtimeRouteWrite": false,
    "runtimeConfigMutation": false,
    "operationalSearchIndexQuery": false,
    "answerVisibleExposure": false,
    "answerGeneration": false,
    "strictEvidenceCreation": false,
    "citationGradePromotion": false,
    "sourceSpanCreation": false,
    "parsedArtifactEvidenceChunkCreation": false,
    "databaseMutation": false,
    "indexMutation": false,
    "reindexOrReembed": false,
    "parserExecution": false,
    "vaultScan": false,
    "externalDownload": false,
    "branchDeletion": false,
    "githubMutation": false
  },
  "sourceVisualRetrievalHintFinalMergeReview": {
    "schema": "knowledge-hub.paper.limited-visual-retrieval-hint-final-merge-review.v1",
    "status": "ready",
    "decision": "visual_retrieval_hint_candidate_discovery_tranche_complete",
    "nextRecommendedTranche": "paper_retrieval_lane_split_parsed_artifact_evidence_chunk_dry_run",
    "reportRef": "eval/knowledgeos/reports/limited_visual_retrieval_hint_final_merge_review_005.v1.json",
    "counts": {
      "reviewRows": 125,
      "plannedRouteBindingRows": 125,
      "candidateDiscoveryOnlyRows": 125,
      "qualityEvalProductionVectorHitAt5Rows": 234,
      "qualityEvalHybridHitAt5Rows": 241,
      "qualityEvalHybridHitAt5LiftRows": 108,
      "qualityEvalRankRegressedRows": 0,
      "blockedRows": 0,
      "privatePathLeakRows": 0,
      "schemaViolationCount": 0
    }
  },
  "method": {
    "name": "paper_retrieval_lane_split_parsed_artifact_evidence_chunk_dry_run_v1",
    "description": "Plans separate retrieval lanes so visual hints can only expand paper candidates and parsed-artifact evidence chunks remain the answerability lane.",
    "completionBoundary": "dry_run_report_only",
    "nextEvidenceWork": "paper_retrieval_lane_split_parsed_artifact_evidence_chunk_contract_review"
  },
  "laneSemantics": {
    "candidateDiscoveryLane": "visual_retrieval_hint_candidate_discovery",
    "answerEvidenceLane": "parsed_artifact_evidence_chunk",
    "candidateDiscoveryMayPrecedeEvidenceResolution": true,
    "visualHintTextMaySatisfyAnswerability": false,
    "visualHintTextMayBeQuotedAsEvidence": false,
    "parsedArtifactEvidenceMustCarrySourceHashAndLocator": true
  },
  "counts": {
    "sourceFinalMergeReviewRows": 125,
    "sourcePlannedRouteBindingRows": 125,
    "sourceCandidateDiscoveryOnlyRows": 125,
    "sourceQualityEvalHybridHitAt5Rows": 241,
    "sourceQualityEvalHybridHitAt5LiftRows": 108,
    "sourceQualityEvalRankRegressedRows": 0,
    "retrievalLaneRows": 2,
    "plannedLaneSplitRows": 2,
    "parsedArtifactEvidenceChunkLaneRows": 1,
    "visualCandidateDiscoveryLaneRows": 1,
    "answerEvidenceEligibleLaneRows": 1,
    "answerEvidenceIneligibleLaneRows": 1,
    "answerabilityEligibleLaneRows": 1,
    "answerabilityIneligibleLaneRows": 1,
    "visualHintRowsQuarantinedFromAnswerEvidence": 125,
    "fallbackToVisualHintAsEvidenceAllowedRows": 0,
    "blockedRows": 0,
    "privatePathLeakRows": 0,
    "schemaViolationCount": 0,
    "runtimeRouteWriteRows": 0,
    "runtimeConfigMutationRows": 0,
    "operationalSearchIndexQueryRows": 0,
    "runtimeVisibleRows": 0,
    "answerVisibleRows": 0,
    "answerGenerationRows": 0,
    "strictEvidenceRows": 0,
    "citationGradeRows": 0,
    "runtimeEvidenceRows": 0,
    "answerableWithoutTextEvidenceRows": 0,
    "candidateStoreWriteRows": 0,
    "sourceSpanCreatedRows": 0,
    "sourceSpanCandidateCreatedRows": 0,
    "parsedArtifactEvidenceChunkCreatedRows": 0,
    "embeddingCallRows": 0,
    "embeddingVectorWriteRows": 0,
    "vectorIndexWriteRows": 0,
    "productionVectorIndexWriteRows": 0,
    "databaseMutationRows": 0,
    "indexMutationRows": 0,
    "reindexOrReembedRows": 0,
    "parserExecutionRows": 0,
    "canonicalParsedArtifactWriteRows": 0,
    "graphDbWriteRows": 0,
    "ontologyWriteRows": 0,
    "memoryCardWriteRows": 0,
    "clusterWriteRows": 0,
    "vaultScanRows": 0,
    "externalDownloadRows": 0,
    "branchDeletionRows": 0,
    "githubPrMutationRows": 0
  },
  "gate": {
    "passed": true,
    "checks": {
      "sourceFinalMergeReviewReady": true,
      "sourceVisualHintsExactly125": true,
      "twoRetrievalLanesPlanned": true,
      "parsedArtifactEvidenceLanePresent": true,
      "visualCandidateDiscoveryLanePresent": true,
      "onlyParsedLaneMaySupplyAnswerEvidence": true,
      "onlyParsedLaneMaySatisfyAnswerability": true,
      "visualHintsQuarantinedFromAnswerEvidence": true,
      "fallbackToVisualHintAsEvidenceDisallowed": true,
      "noBlockedRows": true,
      "noPrivatePathLeaks": true,
      "noMutationOrRuntimeExposure": true
    },
    "expectedVisualHintRows": 125,
    "observed": {
      "sourceCandidateDiscoveryOnlyRows": 125,
      "plannedLaneSplitRows": 2,
      "parsedArtifactEvidenceChunkLaneRows": 1,
      "visualCandidateDiscoveryLaneRows": 1,
      "blockedRows": 0
    }
  },
  "retrievalLaneRows": [
    {
      "schema": "knowledge-hub.paper.paper-retrieval-lane-split-dry-run-row.v1",
      "rowId": "paper-retrieval-lane-split:bc514a349dfd5e31d42a1ccb",
      "status": "paper_retrieval_lane_split_dry_run_ready",
      "laneName": "parsed_artifact_evidence_chunk",
      "laneKind": "answer_evidence",
      "sourceType": "paper",
      "retrievalUnitKind": "parsed_artifact_evidence_chunk",
      "targetRuntimeBoundary": "knowledge_hub.ai.rag_search_runtime.RAGSearchRuntime.search_with_diagnostics",
      "targetPipelineBoundary": "knowledge_hub.ai.retrieval_pipeline.RetrievalPipelineService.execute",
      "targetEvidenceBoundary": "knowledge_hub.ai.evidence_assembly.EvidenceAssemblyService.assemble",
      "upstreamCandidateDiscoveryLane": "visual_retrieval_hint_candidate_discovery",
      "lanePolicy": {
        "mayExpandSearchCandidates": true,
        "maySupplyAnswerEvidence": true,
        "maySatisfyAnswerability": true,
        "answerVisibleAllowedAfterContract": true,
        "strictTextEvidenceRequired": true,
        "visualHintTextMayBeQuotedAsEvidence": false,
        "candidateDiscoveryOnly": false,
        "requiresSourceContentHash": true,
        "requiresLocator": true,
        "requiresEvidenceContract": true,
        "fallbackToVisualHintAsEvidenceAllowed": false
      },
      "evidenceContract": {
        "contractName": "parsed_artifact_source_hash_locator_text_span_contract",
        "requiredForAnswerability": true,
        "requiredFields": [
          "sourceContentHash",
          "source_type=paper",
          "chars:start-end_or_page_bbox",
          "excerpt_or_text_span"
        ],
        "disallowedEvidenceSources": [
          "visual_retrieval_hint_text",
          "locator_only_anchor",
          "memory_unit_locator"
        ]
      },
      "dryRunEffects": {
        "runtimeRouteWrite": false,
        "runtimeConfigMutation": false,
        "operationalSearchIndexQuery": false,
        "answerGeneration": false,
        "answerVisibleExposure": false,
        "strictEvidenceCreation": false,
        "citationGradePromotion": false,
        "sourceSpanCreation": false,
        "parsedArtifactEvidenceChunkCreation": false,
        "databaseMutation": false,
        "indexMutation": false,
        "reindexOrReembed": false,
        "parserExecution": false
      },
      "blockers": [],
      "laneSplitRowSha256": "sha256:082c80121ec3b552731dbd64a5ed1d5c66c1eb6dda8282bdd613318563f63a0b"
    },
    {
      "schema": "knowledge-hub.paper.paper-retrieval-lane-split-dry-run-row.v1",
      "rowId": "paper-retrieval-lane-split:a5ff7310589f7683249c3c66",
      "status": "paper_retrieval_lane_split_dry_run_ready",
      "laneName": "visual_retrieval_hint_candidate_discovery",
      "laneKind": "candidate_discovery",
      "sourceType": "paper",
      "retrievalUnitKind": "visual_retrieval_hint_candidate_discovery_signal",
      "targetRuntimeBoundary": "knowledge_hub.ai.rag_search_runtime.RAGSearchRuntime.search_with_diagnostics",
      "targetPipelineBoundary": "knowledge_hub.ai.retrieval_pipeline.RetrievalPipelineService.execute",
      "targetEvidenceBoundary": "knowledge_hub.ai.evidence_assembly.EvidenceAssemblyService.assemble",
      "upstreamCandidateDiscoveryLane": "",
      "lanePolicy": {
        "mayExpandSearchCandidates": true,
        "maySupplyAnswerEvidence": false,
        "maySatisfyAnswerability": false,
        "answerVisibleAllowedAfterContract": false,
        "strictTextEvidenceRequired": false,
        "visualHintTextMayBeQuotedAsEvidence": false,
        "candidateDiscoveryOnly": true,
        "requiresSourceContentHash": false,
        "requiresLocator": false,
        "requiresEvidenceContract": false,
        "fallbackToVisualHintAsEvidenceAllowed": false
      },
      "evidenceContract": {
        "contractName": "retrieval_hint_candidate_discovery_only_contract",
        "requiredForAnswerability": false,
        "requiredFields": [],
        "disallowedEvidenceSources": [